{
  "$schema": "https://json-schema.org/draft/2020-12/schema",
  "$id": "https://specs.hermes-agent.nousresearch.com/hotl/0.2/schema.json",
  "title": "HOTL 0.2 orchestration document",
  "type": "object",
  "additionalProperties": false,
  "required": [
    "specVersion",
    "graphId",
    "revision",
    "intentGraph",
    "policies",
    "constraints",
    "provenance"
  ],
  "properties": {
    "specVersion": {
      "const": "0.2"
    },
    "graphId": {
      "type": "string"
    },
    "revision": {
      "type": "integer",
      "minimum": 0
    },
    "intentGraph": {
      "$ref": "#/$defs/graph"
    },
    "observedGraph": {
      "$ref": "#/$defs/graph"
    },
    "policies": {
      "type": "object"
    },
    "constraints": {
      "type": "object",
      "required": [
        "budgets",
        "termination"
      ],
      "properties": {
        "budgets": {
          "type": "object"
        },
        "termination": {
          "type": "object"
        }
      }
    },
    "provenance": {
      "type": "object",
      "required": [
        "sourceHash"
      ],
      "properties": {
        "sourceHash": {
          "type": "string",
          "pattern": "^[a-f0-9]{64}$"
        },
        "source": {
          "type": "string"
        }
      }
    },
    "plan": {
      "type": "object"
    },
    "eventLog": {
      "type": "array",
      "items": {
        "$ref": "#/$defs/event"
      }
    }
  },
  "$defs": {
    "graph": {
      "type": "object",
      "required": [
        "nodes",
        "edges"
      ],
      "additionalProperties": false,
      "properties": {
        "nodes": {
          "type": "array",
          "minItems": 1,
          "items": {
            "$ref": "#/$defs/node"
          }
        },
        "edges": {
          "type": "array",
          "items": {
            "$ref": "#/$defs/edge"
          }
        }
      }
    },
    "node": {
      "type": "object",
      "additionalProperties": false,
      "required": [
        "id",
        "kind",
        "ports",
        "capabilities"
      ],
      "properties": {
        "id": {
          "type": "string",
          "pattern": "^[A-Za-z][A-Za-z0-9_.:-]{0,127}$"
        },
        "kind": {
          "enum": [
            "task",
            "executor",
            "model",
            "tool",
            "service",
            "memory",
            "stateStore",
            "humanGate",
            "environment",
            "artifact",
            "verifier"
          ]
        },
        "harness": {
          "type": "string",
          "pattern": "^[A-Za-z][A-Za-z0-9_.:-]{0,127}$"
        },
        "ports": {
          "type": "array",
          "items": {
            "type": "object",
            "required": [
              "id",
              "direction",
              "schema"
            ],
            "properties": {
              "id": {
                "type": "string"
              },
              "direction": {
                "enum": [
                  "in",
                  "out"
                ]
              },
              "schema": {
                "type": "string"
              },
              "classification": {
                "type": "string"
              }
            }
          }
        },
        "capabilities": {
          "type": "array",
          "items": {
            "type": "string"
          }
        },
        "authorityCeiling": {
          "type": "array",
          "items": {
            "type": "string"
          }
        },
        "lifecycle": {
          "enum": [
            "declared",
            "ready",
            "running",
            "succeeded",
            "failed",
            "cancelled"
          ]
        },
        "authorityScopes": {
          "type": "array",
          "items": {
            "$ref": "#/$defs/authorityScope"
          }
        },
        "prohibitions": {
          "type": "array",
          "items": {
            "$ref": "#/$defs/prohibition"
          }
        }
      },
      "allOf": [
        {
          "if": {
            "properties": {
              "kind": {
                "const": "executor"
              }
            },
            "required": [
              "kind"
            ]
          },
          "else": {
            "not": {
              "required": [
                "harness"
              ]
            }
          },
          "description": "`harness` is only meaningful on an executor. The Python validator has always enforced this and the schema did not, so a document putting a harness on a task node passed the published schema and failed the validator -- the schema being MORE PERMISSIVE, which is the direction that misleads an external consumer. Expressing it here is possible; the catalog-dependent half of the rule (is the harness id known, is its kind control-room) is not, and stays in Python."
        },
        {
          "if": {
            "properties": {
              "kind": {
                "const": "executor"
              }
            },
            "required": [
              "kind"
            ]
          },
          "else": {
            "not": {
              "required": [
                "authorityScopes"
              ]
            }
          },
          "description": "authorityScopes are only meaningful on an executor (the principal that acts)."
        }
      ]
    },
    "edge": {
      "type": "object",
      "additionalProperties": false,
      "required": [
        "id",
        "relation",
        "from",
        "to",
        "fromPort",
        "toPort",
        "delivery",
        "authority",
        "provenance"
      ],
      "properties": {
        "id": {
          "type": "string"
        },
        "relation": {
          "enum": [
            "dependency",
            "data",
            "message",
            "delegation",
            "critique",
            "verification",
            "allocation",
            "control",
            "observation",
            "artifact"
          ]
        },
        "from": {
          "type": "string"
        },
        "to": {
          "type": "string"
        },
        "fromPort": {
          "type": "string"
        },
        "toPort": {
          "type": "string"
        },
        "delivery": {
          "type": "object",
          "required": [
            "order",
            "idempotent"
          ],
          "properties": {
            "order": {
              "enum": [
                "ordered",
                "unordered",
                "latest"
              ]
            },
            "idempotent": {
              "type": "boolean"
            },
            "timeoutMs": {
              "type": "integer",
              "minimum": 0
            },
            "maxRetries": {
              "type": "integer",
              "minimum": 0
            }
          }
        },
        "authority": {
          "type": "object",
          "required": [
            "grant",
            "delegationDepth"
          ],
          "properties": {
            "grant": {
              "type": "array",
              "items": {
                "type": "string"
              }
            },
            "delegationDepth": {
              "type": "integer",
              "minimum": 0
            }
          }
        },
        "budget": {
          "type": "object"
        },
        "evidence": {
          "type": "object"
        },
        "provenance": {
          "type": "object",
          "required": [
            "sourceHash"
          ]
        }
      }
    },
    "event": {
      "type": "object",
      "required": [
        "eventId",
        "type",
        "sourceHash",
        "revision",
        "causalParents",
        "payload"
      ],
      "properties": {
        "eventId": {
          "type": "string"
        },
        "type": {
          "enum": [
            "spawn",
            "bind",
            "route",
            "retry",
            "cancel",
            "addNode",
            "removeNode",
            "addEdge",
            "removeEdge",
            "stateUpdate",
            "snapshot"
          ]
        },
        "sourceHash": {
          "type": "string"
        },
        "revision": {
          "type": "integer"
        },
        "causalParents": {
          "type": "array",
          "items": {
            "type": "string"
          }
        },
        "payload": {
          "type": "object"
        }
      }
    },
    "scopeTargets": {
      "type": "object",
      "additionalProperties": false,
      "minProperties": 1,
      "properties": {
        "repos": {
          "type": "array",
          "minItems": 1,
          "items": {
            "type": "string",
            "minLength": 1,
            "not": {
              "enum": [
                "*",
                "**",
                "any",
                "all",
                "every",
                "everything",
                "anything",
                "non_default"
              ]
            },
            "pattern": "^[^*?]+$"
          }
        },
        "branches": {
          "type": "array",
          "minItems": 1,
          "items": {
            "type": "string",
            "minLength": 1,
            "not": {
              "enum": [
                "*",
                "**",
                "any",
                "all",
                "every",
                "everything",
                "anything",
                "non_default"
              ]
            },
            "pattern": "^[^*?]+$"
          }
        },
        "paths": {
          "type": "array",
          "minItems": 1,
          "items": {
            "type": "string",
            "minLength": 1,
            "not": {
              "enum": [
                "*",
                "**",
                "any",
                "all",
                "every",
                "everything",
                "anything",
                "non_default"
              ]
            },
            "pattern": "^[^*?]+$"
          }
        },
        "hosts": {
          "type": "array",
          "minItems": 1,
          "items": {
            "type": "string",
            "minLength": 1,
            "not": {
              "enum": [
                "*",
                "**",
                "any",
                "all",
                "every",
                "everything",
                "anything",
                "non_default"
              ]
            },
            "pattern": "^[^*?]+$"
          }
        },
        "units": {
          "type": "array",
          "minItems": 1,
          "items": {
            "type": "string",
            "minLength": 1,
            "not": {
              "enum": [
                "*",
                "**",
                "any",
                "all",
                "every",
                "everything",
                "anything",
                "non_default"
              ]
            },
            "pattern": "^[^*?]+$"
          }
        },
        "packages": {
          "type": "array",
          "minItems": 1,
          "items": {
            "type": "string",
            "minLength": 1,
            "not": {
              "enum": [
                "*",
                "**",
                "any",
                "all",
                "every",
                "everything",
                "anything",
                "non_default"
              ]
            },
            "pattern": "^[^*?]+$"
          }
        },
        "envs": {
          "type": "array",
          "minItems": 1,
          "items": {
            "type": "string",
            "minLength": 1,
            "not": {
              "enum": [
                "*",
                "**",
                "any",
                "all",
                "every",
                "everything",
                "anything",
                "non_default"
              ]
            },
            "pattern": "^[^*?]+$"
          }
        },
        "prs": {
          "type": "array",
          "minItems": 1,
          "items": {
            "type": "string",
            "minLength": 1,
            "not": {
              "enum": [
                "*",
                "**",
                "any",
                "all",
                "every",
                "everything",
                "anything",
                "non_default"
              ]
            },
            "pattern": "^[^*?]+$"
          }
        }
      },
      "description": "Exact targets (spec/authority-scopes.md). Wildcards are rejected; the validator also rejects them case-insensitively."
    },
    "authorityScope": {
      "type": "object",
      "additionalProperties": false,
      "required": [
        "effect",
        "targets"
      ],
      "properties": {
        "effect": {
          "type": "string",
          "pattern": "^[a-z][a-z0-9_]{0,63}$",
          "not": {
            "enum": [
              "payment",
              "finance",
              "pay",
              "transfer",
              "wallet"
            ]
          }
        },
        "targets": {
          "$ref": "#/$defs/scopeTargets"
        }
      },
      "description": "Narrows one authorityCeiling entry of an executor to exact targets. The effect must be on the node's authorityCeiling (validator-only rule)."
    },
    "prohibition": {
      "type": "object",
      "additionalProperties": false,
      "required": [
        "effect"
      ],
      "properties": {
        "effect": {
          "type": "string",
          "pattern": "^[a-z][a-z0-9_]{0,63}$",
          "not": {
            "enum": [
              "payment",
              "finance",
              "pay",
              "transfer",
              "wallet"
            ]
          }
        },
        "targets": {
          "$ref": "#/$defs/scopeTargets"
        }
      },
      "description": "Removes authority for an effect (optionally only for the named targets). Binds every executor in the contract."
    }
  }
}
