{
  "specVersion": "0.2",
  "graphId": "authority-scopes",
  "revision": 0,
  "intentGraph": {
    "nodes": [
      {
        "id": "intent",
        "kind": "task",
        "ports": [
          {
            "id": "in",
            "direction": "in",
            "schema": "Task"
          },
          {
            "id": "out",
            "direction": "out",
            "schema": "Task"
          }
        ],
        "capabilities": [
          "execute"
        ],
        "authorityCeiling": [
          "execute"
        ],
        "lifecycle": "declared",
        "prohibitions": [
          {
            "effect": "deploy"
          }
        ]
      },
      {
        "id": "agent",
        "kind": "executor",
        "harness": "claude",
        "ports": [
          {
            "id": "in",
            "direction": "in",
            "schema": "Task"
          },
          {
            "id": "out",
            "direction": "out",
            "schema": "Task"
          }
        ],
        "capabilities": [
          "execute"
        ],
        "authorityCeiling": [
          "execute",
          "push",
          "pr",
          "install"
        ],
        "lifecycle": "declared",
        "authorityScopes": [
          {
            "effect": "push",
            "targets": {
              "repos": [
                "~/workspace/aodl"
              ],
              "branches": [
                "feat/authority-scopes"
              ]
            }
          },
          {
            "effect": "pr",
            "targets": {
              "repos": [
                "~/workspace/aodl"
              ]
            }
          },
          {
            "effect": "install",
            "targets": {
              "packages": [
                "jsonschema"
              ]
            }
          }
        ],
        "prohibitions": [
          {
            "effect": "push",
            "targets": {
              "branches": [
                "main",
                "dev"
              ]
            }
          },
          {
            "effect": "merge"
          }
        ]
      },
      {
        "id": "tool",
        "kind": "tool",
        "ports": [
          {
            "id": "in",
            "direction": "in",
            "schema": "Task"
          },
          {
            "id": "out",
            "direction": "out",
            "schema": "Task"
          }
        ],
        "capabilities": [
          "execute"
        ],
        "authorityCeiling": [
          "execute"
        ],
        "lifecycle": "declared"
      },
      {
        "id": "verify",
        "kind": "verifier",
        "ports": [
          {
            "id": "in",
            "direction": "in",
            "schema": "Task"
          },
          {
            "id": "out",
            "direction": "out",
            "schema": "Task"
          }
        ],
        "capabilities": [
          "execute"
        ],
        "authorityCeiling": [
          "execute"
        ],
        "lifecycle": "declared"
      }
    ],
    "edges": [
      {
        "id": "e-intent-agent",
        "relation": "dependency",
        "from": "intent",
        "to": "agent",
        "fromPort": "out",
        "toPort": "in",
        "delivery": {
          "order": "ordered",
          "idempotent": true,
          "timeoutMs": 60000,
          "maxRetries": 0
        },
        "authority": {
          "grant": [
            "execute"
          ],
          "delegationDepth": 0
        },
        "provenance": {
          "sourceHash": "0a98a13e7c5b87ffc21be62dff3d051fc94ba369ce8528b248a639f072195531"
        }
      },
      {
        "id": "e-agent-tool",
        "relation": "dependency",
        "from": "agent",
        "to": "tool",
        "fromPort": "out",
        "toPort": "in",
        "delivery": {
          "order": "ordered",
          "idempotent": true,
          "timeoutMs": 60000,
          "maxRetries": 0
        },
        "authority": {
          "grant": [
            "execute"
          ],
          "delegationDepth": 0
        },
        "provenance": {
          "sourceHash": "0a98a13e7c5b87ffc21be62dff3d051fc94ba369ce8528b248a639f072195531"
        }
      },
      {
        "id": "e-tool-verify",
        "relation": "verification",
        "from": "tool",
        "to": "verify",
        "fromPort": "out",
        "toPort": "in",
        "delivery": {
          "order": "ordered",
          "idempotent": true,
          "timeoutMs": 60000,
          "maxRetries": 0
        },
        "authority": {
          "grant": [
            "execute"
          ],
          "delegationDepth": 0
        },
        "provenance": {
          "sourceHash": "0a98a13e7c5b87ffc21be62dff3d051fc94ba369ce8528b248a639f072195531"
        }
      }
    ]
  },
  "policies": {
    "kinds": [
      "sequence",
      "retry"
    ],
    "fanIn": "all",
    "dynamic": {
      "allowed": false,
      "maxChildren": 0,
      "maxDepth": 0
    }
  },
  "constraints": {
    "budgets": {
      "tokens": 0
    },
    "termination": {
      "on": "verifier.succeeded"
    }
  },
  "provenance": {
    "source": "example",
    "sourceHash": "0a98a13e7c5b87ffc21be62dff3d051fc94ba369ce8528b248a639f072195531"
  }
}
