{"constraints":{"budgets":{"calls":10},"termination":{"maxSteps":10}},"graphId":"gate-api-ping","intentGraph":{"edges":[{"authority":{"delegationDepth":1,"grant":["execute"]},"delivery":{"idempotent":true,"order":"ordered"},"from":"planner","fromPort":"out","id":"e-plan-work","provenance":{"sourceHash":"aaaaaaaaaaaaaaaaaaaaaaaaaaaaaaaaaaaaaaaaaaaaaaaaaaaaaaaaaaaaaaaa"},"relation":"delegation","to":"worker","toPort":"in"}],"nodes":[{"authorityCeiling":["execute"],"capabilities":["execute"],"id":"planner","kind":"task","ports":[{"direction":"out","id":"out","schema":"Task"}]},{"authorityCeiling":["execute"],"capabilities":["execute"],"id":"worker","kind":"executor","ports":[{"direction":"in","id":"in","schema":"Task"}]}]},"policies":{"dynamic":{"allowed":false,"maxChildren":0,"maxDepth":0},"fanIn":"all","kinds":["sequence"]},"provenance":{"sourceHash":"bbbbbbbbbbbbbbbbbbbbbbbbbbbbbbbbbbbbbbbbbbbbbbbbbbbbbbbbbbbbbbbb"},"revision":0,"specVersion":"0.2"}